{
  "schema": "v49.execution-attempt.v1",
  "project_id": "CHATGPT_GLOBAL_SKILL_GOVERNANCE",
  "mission_revision": "20260926T220900+0800",
  "mission_hash": "sha256:3cd12c504e42247f52b2f8200ee590a7d1e6e1f0e58c15063cb9551ebf9a38a5",
  "authorization_envelope_digest": "sha256:25e5e06317eecd33c85a5616aba7bcc9e900bd6207b39fe86b118aa7b0b86011",
  "run_id": "CHATGPT_GLOBAL_SKILL_GOVERNANCE",
  "atomic_unit_id": "GOV-R3-P0-04-OBSERVER-BOOTSTRAP",
  "attempt_id": "V50-R3-P0-04-ATTEMPT-001",
  "attempt_epoch": 1,
  "operation_id": "GOV-R3-P0-04-OBSERVER-INSTALL-001",
  "state": "READY",
  "started_at": "2026-09-28T02:30:00Z",
  "deadline": "2026-09-28T06:00:00Z",
  "finished_at": null,
  "executor": "CHATGPT_CONTROLLER",
  "tool": "FACTORY_MCP_HOST_POWERSHELL",
  "route": "SYSTEM_BROKER",
  "mutation_class": "LOCAL_EXECUTION",
  "provider_precondition": {
    "accepted_source_head": "7784663cca65dc7b0aa96c599db3224ad8317817",
    "canonical_checkpoint_seq": 192,
    "previous_control_head": "3fe64c651dd97fff75a74c668dc81f3fa2626c8f",
    "payload_source_commit": "7104a1a5b460b4e90ad6029464f9b1a79291906a",
    "script_sha256": "sha256:6fc41ea5bd5a88a96dea41a251a8bdd6d3bf551c2c69d32700b5dff42830e4db"
  },
  "idempotency_key": "GOV-R3-P0-04-OBSERVER-INSTALL-001",
  "side_effect_state": "NONE",
  "readback_state": "NOT_REQUIRED",
  "dispatch_count": 0,
  "readback_count": 0,
  "terminal_reason": null,
  "last_dispatch_observed_at": null,
  "last_provider_observation_ref": null,
  "retry_of_attempt_id": null,
  "retry_of_attempt_epoch": null,
  "attempt_digest": "sha256:9260438bc68e956849dc7bf6baca1dbfaea5b631fb6144e4756a6358e3e7b9a0"
}
